{
  "hsi_version": "1.2",
  "observed_at_utc": "2025-12-28T00:01:00Z",
  "computed_at_utc": "2025-12-28T00:01:00Z",
  "producer": {
    "name": "Example Producer",
    "version": "1.0.0",
    "instance_id": "b1c2d3e4-5f6a-7b8c-9d0e-1f2a3b4c5d6e"
  },
  "windows": {
    "w1": {
      "start_utc": "2025-12-28T00:00:50Z",
      "end_utc": "2025-12-28T00:01:00Z"
    }
  },
  "axes": {
    "behavior": [
      {
        "name": "engagement",
        "score": 0.77,
        "confidence": 0.63,
        "direction": "higher_is_more",
        "inference_mode": "probabilistic_model",
        "model_id": "model://example/engagement-v1",
        "window_ids": ["w1"],
        "evidence_source_ids": []
      },
      {
        "name": "task_persistence",
        "score": 0.58,
        "confidence": 0.55,
        "direction": "higher_is_more",
        "inference_mode": "probabilistic_model",
        "model_id": "model://example/task-persistence-v1",
        "window_ids": ["w1"],
        "evidence_source_ids": []
      }
    ]
  },
  "privacy": {
    "contains_pii": false,
    "raw_biosignals_allowed": false,
    "derived_metrics_allowed": true,
    "consent": "implicit",
    "purposes": ["personalization"]
  },
  "meta": {
    "intent": "Valid example: behavior domain only.",
    "provenance": {
      "baseline_status": "READY",
      "providers": [{ "id": "synheart-behavior", "version": "1.0.0" }],
      "engine": "example-engine",
      "engine_version": "1.0.0"
    }
  }
}
