{
  "hsi_version": "1.2",
  "observed_at_utc": "2025-12-28T00:02:00Z",
  "computed_at_utc": "2025-12-28T00:02:00Z",
  "producer": {
    "name": "Example Producer",
    "version": "1.0.0",
    "instance_id": "d9776c5c-7a2e-4f7e-a827-7db9b2e2edc1"
  },
  "windows": {
    "w1": {
      "start_utc": "2025-12-28T00:01:50Z",
      "end_utc": "2025-12-28T00:02:00Z",
      "label": "10s_window"
    },
    "w2": {
      "start_utc": "2025-12-28T00:01:00Z",
      "end_utc": "2025-12-28T00:02:00Z",
      "label": "60s_window"
    }
  },
  "axes": {
    "physiological": [
      {
        "name": "stress",
        "score": 0.31,
        "confidence": 0.64,
        "direction": "higher_is_more",
        "inference_mode": "probabilistic_model",
        "model_id": "model://example/stress-v1",
        "window_ids": ["w2"],
        "evidence_source_ids": ["s_wearable", "s_app"]
      },
      {
        "name": "calm",
        "score": 0.69,
        "confidence": 0.61,
        "direction": "higher_is_more",
        "inference_mode": "probabilistic_model",
        "model_id": "model://example/calm-v1",
        "window_ids": ["w2"],
        "evidence_source_ids": ["s_wearable"]
      }
    ],
    "behavior": [
      {
        "name": "attention",
        "score": 0.73,
        "confidence": 0.58,
        "direction": "higher_is_more",
        "inference_mode": "deterministic_rule",
        "model_id": "rulepack://attention_v1",
        "window_ids": ["w1"],
        "evidence_source_ids": ["s_app"]
      }
    ],
    "context": [
      {
        "name": "activity_still_conf",
        "score": 0.85,
        "confidence": 0.92,
        "direction": "higher_is_more",
        "inference_mode": "deterministic_rule",
        "model_id": "rulepack://context_activity_v1",
        "window_ids": ["w1"],
        "evidence_source_ids": []
      },
      {
        "name": "baseline_ready",
        "score": 1,
        "confidence": 1.0,
        "direction": "higher_is_more",
        "inference_mode": "deterministic_rule",
        "model_id": "rulepack://baseline_flags_v1",
        "window_ids": ["w2"],
        "evidence_source_ids": []
      },
      {
        "name": "baseline_maturity",
        "score": 0.68,
        "confidence": 0.9,
        "direction": "higher_is_more",
        "inference_mode": "probabilistic_model",
        "model_id": "model://example/baseline-maturity-v1",
        "window_ids": ["w2"],
        "evidence_source_ids": []
      }
    ]
  },
  "embeddings": [
    {
      "window_id": "w1",
      "vector": [0.12, -0.03, 0.44, 0.09],
      "dimension": 4,
      "encoding": "float32",
      "confidence": 0.52,
      "model": "example.invalid/model/example-embed-1"
    }
  ],
  "privacy": {
    "contains_pii": false,
    "raw_biosignals_allowed": true,
    "derived_metrics_allowed": true,
    "embedding_allowed": true,
    "consent": "explicit",
    "purposes": ["research", "personalization"],
    "notes": "Embedding included; treat as sensitive."
  },
  "meta": {
    "intent": "Valid example: physiological + behavior + context + provenance sources + embedding.",
    "provenance": {
      "sources": {
        "s_wearable": {
          "type": "sensor",
          "quality": 0.83,
          "degraded": false,
          "notes": "Generic sensor source; no device assumptions."
        },
        "s_app": {
          "type": "app",
          "quality": 0.74,
          "degraded": false
        }
      },
      "baseline_status": "READY",
      "providers": [{ "id": "example-focus-provider", "version": "2.1.0" }]
    }
  }
}
