{
  "hsi_version": "1.2",
  "observed_at_utc": "2025-12-28T00:06:00Z",
  "computed_at_utc": "2025-12-28T00:06:00Z",
  "producer": {
    "name": "Example Producer",
    "version": "1.0.0",
    "instance_id": "f6a7b8c9-d0e1-2f3a-4b5c-6d7e8f9a0b1c"
  },
  "windows": {
    "w1": {
      "start_utc": "2025-12-28T00:05:50Z",
      "end_utc": "2025-12-28T00:06:00Z",
      "label": "10s_window"
    }
  },
  "axes": {
    "behavior": [
      {
        "name": "attention",
        "score": 0.8,
        "confidence": 0.08,
        "direction": "higher_is_more",
        "inference_mode": "probabilistic_model",
        "model_id": "model://example/attention-v1",
        "window_ids": ["w1"],
        "evidence_source_ids": [],
        "notes": "High score but low confidence: consumer should down-weight."
      }
    ]
  },
  "privacy": {
    "contains_pii": false,
    "raw_biosignals_allowed": false,
    "derived_metrics_allowed": true,
    "consent": "implicit",
    "purposes": ["research"]
  },
  "meta": {
    "intent": "Test vector: low confidence reading.",
    "provenance": {
      "baseline_status": "WARMING",
      "providers": [{ "id": "synheart-behavior", "version": "1.0.0" }],
      "engine": "example-engine",
      "engine_version": "1.0.0"
    }
  }
}
