{
  "hsi_version": "1.2",
  "observed_at_utc": "2025-12-28T00:10:00Z",
  "computed_at_utc": "2025-12-28T00:10:01Z",
  "producer": {
    "name": "Example Producer",
    "version": "1.0.0",
    "instance_id": "c4d5e6f7-8a9b-0c1d-2e3f-4a5b6c7d8e9f"
  },
  "windows": {
    "w1": {
      "start_utc": "2025-12-28T00:09:00Z",
      "end_utc": "2025-12-28T00:10:00Z",
      "label": "60s_window"
    }
  },
  "axes": {
    "physiological": [
      {
        "name": "stress",
        "score": null,
        "confidence": 0.42,
        "direction": "higher_is_more",
        "inference_mode": "external_provider",
        "model_id": "provider://stress-unavailable",
        "window_ids": ["w1"],
        "evidence_source_ids": [],
        "notes": "Score is null due to missing authorized sources."
      }
    ]
  },
  "privacy": {
    "contains_pii": false,
    "raw_biosignals_allowed": false,
    "derived_metrics_allowed": true,
    "consent": "implicit",
    "purposes": ["research"]
  },
  "meta": {
    "null_reading_reason": "access_control_or_missing_sources",
    "provenance": {
      "baseline_status": "WARMING",
      "providers": [{ "id": "synheart-stress", "version": "2.0.0" }],
      "engine": "example-engine",
      "engine_version": "1.0.0"
    }
  }
}
