{
  "hsi_version": "1.2",
  "observed_at_utc": "2025-12-28T00:00:10Z",
  "computed_at_utc": "2025-12-28T00:00:10Z",
  "producer": {
    "name": "Example Producer",
    "version": "1.0.0",
    "instance_id": "0b6f3ac9-62f5-4c9f-9f0d-4c4b3f6b2a3b"
  },
  "windows": {
    "w1": {
      "start_utc": "2025-12-28T00:00:00Z",
      "end_utc": "2025-12-28T00:00:10Z",
      "label": "10s_window"
    }
  },
  "axes": {
    "physiological": [
      {
        "name": "valence",
        "score": 0.62,
        "confidence": 0.71,
        "direction": "higher_is_more",
        "inference_mode": "probabilistic_model",
        "model_id": "model://example/valence-v1",
        "window_ids": ["w1"],
        "evidence_source_ids": []
      },
      {
        "name": "arousal",
        "score": 0.44,
        "confidence": 0.68,
        "direction": "higher_is_more",
        "inference_mode": "probabilistic_model",
        "model_id": "model://example/arousal-v1",
        "window_ids": ["w1"],
        "evidence_source_ids": []
      }
    ]
  },
  "privacy": {
    "contains_pii": false,
    "raw_biosignals_allowed": false,
    "derived_metrics_allowed": true,
    "consent": "implicit",
    "purposes": ["personalization"]
  },
  "meta": {
    "intent": "Valid example: physiological domain only.",
    "provenance": {
      "baseline_status": "READY",
      "providers": [
        { "id": "synheart-physio", "version": "2.0.0" }
      ],
      "engine": "example-engine",
      "engine_version": "1.0.0"
    }
  }
}
